{
  "schema_version": "1.1",
  "appearance": { "theme_id": "dark_default", "accent_color": "#E50914", "font_scale": 1.0, "ui_scale": 1.0 },
  "system": { "language": "pt-BR", "timezone": "America/Sao_Paulo", "brightness": 80, "suspend_timeout_s": 300, "usb_mode": "mtp" },
  "sound": { "master_volume": 70, "game_volume": 80, "music_volume": 60, "muted": false },
  "store": { "region": "BR", "source": "curated" },
  "network": {
    "wifi_enabled": false,
    "wifi_last_ssid": null,
    "wifi_credentials": [],
    "bluetooth_enabled": false,
    "bluetooth_paired": []
  }
}
